epoch,scrping_dt,ad_id_indeed,ad_jobtitle_indeed,ad_cie_indeed,ad_jobloc_indeed,ad_post_dt_indeed,ad_jobdes_indeed,search_ad_url,ad_url,ad_jobdate,ad_jobtitle,ad_jobcie,ad_jobdes,ad_email
1514871688.0,2018-01-02 13:41:28,b559476c9497a6ae,Software engineer - Software Engineer,WHub,Hong Kong,30+ days ago,"Full time


Hong Kong


Software engineer


starting date : 2017-12-01


AlikeAudience can not provide a visa.


Description


//Intro:


AlikeAudience is looking for a Full-time Software Engineer to work out of our HONG KONG office and be responsible for the development and delivery of the company’s core big data technology, the mobile audience intelligence platform.


You will pursue market adoption of data-driven marketing and programmatic advertising solutions in APAC. Day-to-day works include “learn-by-research” on the fast moving #MadTech landscape, support the team on technical aspect including billions of daily mobile user activities injection and audience segment creation with machine learning. This full-time position reports to the CTO on daily operations. Fresh graduates are welcome.


//What we are solving:


Programmatic advertising in APAC is growing significantly in 2016, when data-driven marketers deliver the right message to the right end user in a right time on a right device. Meantime, publishers and app developers, collectively media owners, have yet to fulfill marketers’ targeting demand and deliver engaging and sponsored contents to end users. With AlikeAudience’s Mobile Audience Intelligence Platform, we onboard billions of daily mobile activities across data providers and data sources, build user segments by interests and behaviors, and make them available to marketers across marketing clouds and programmatic platforms (E.g. DSP). Our vision is to connect marketers to valuable mobile audiences with diversity, transparency, and effectiveness.


//Why AlikeAudience:


Joining AlikeAudience provides candidates an opportunity to work with a team of startup entrepreneurs, digital visionaries, data scientists and engineers form UC Berkeley, Princeton University, Columbia University, HKUST, and HK Polytechnic University. We are a fast growing company with seed investment by angels and pioneers in AdTech, and Plug and Play Ventures, a leading accelerator in Silicon Valley. We operate in a lean startup fashion providing flexible working hours, home office policy, and year-round free access to gym, pool, and yoga classes.


Alibaba Entrepreneurs Fund has selected AlikeAudience the Top 3 Big Data | AI Startup in Jumpstarter Competition.


//Responsibilities:


•  Build proprietary tools to facilitate terabytes data collection, processing, and visualization in both real time and batch basis

•  Participant in design and code reviews with senior engineers to define and develop new capabilities

•  Work in a fast-paced, energetic, and flexible startup environment, with a talented, diverse, and forward-thinking team

•  Demonstrated self-motivation to work independently, as well as a part of a high-performing team


//Qualifications:


•  Bachelor Degree in Computer Science, Engineering or related discipline

• Proven skills in one or more of the following: Java, PHP, Python, web development with JavaScript and Node.js, mobile application development in Android or iOS

• Previous experience in web development is preferred.

• Knowledge of Big data and NoSQL technologies such as Hadoop YARN, Spark, Hive, Cassandra, HBase, Storm, CASK, Kafka, Flume is a plus

•  Traditional databases and data related tools such as MySQL.


Salary

Equity part is negotiable.


Salary range / month : HK$ 20k-40k


WHubber factors
Startups have different perks to offer to talent. Here is their allocation of 100 points.


Flexible Role and Responsibility


Impact on Society


Compensation


Flexible hours


Flexible location


Flexible Role and Responsability30


Created on: 2017/11/12


about AlikeAudience",https://www.indeed.hk/rc/clk?jk=b559476c9497a6ae&fccid=eb9b4575af3a03e4,http://whub.io/startups/alikeaudience/jobs/software-engineer-software-engineer-1510478522,nan,nan,nan,nan,nan
1514871688.0,2018-01-02 13:41:28,1c6fbe089f0d99e4,Business Analyst,lalamove,Hong Kong,30+ days ago,"At Lalamove, you will work with a fun team of seasoned Product Managers, Designers and Data Scientists in a fast-paced, rapidly growing, dynamic company in the forefront of on-demand economy in Asia. This role demands meticulous attention to detail, outstanding communication skills, and outside of the box thinking, always with the end customer in mind. You will assist in writing user stories, product documentation, test materials, release notes, and help our product owners manage their product backlogs. The role will include regular liaison with our city operations across Asia, where you will be required to analyse user behavior in unique regional contexts. It will also involve troubleshooting and researching problems, evaluating the usability of product features and conducting in-depth market analysis.


Does this sound interesting to you? Maybe because it is! 

What we seek:
You are passionate about building new products and making them better by relentlessly digging for relevant customer insight. (bonus points if you’ve built your own app or website!)
Meticulous attention to detail to spot small details which make a big impact.
Interest in getting involved with new tech with real-world applications to make a difference.
Great with producing detailed product requirements and understand related processes with an intuition of when and to what extent they need to be applied.
Good at multitasking and able to stay organized so that new features and updates are rolled out on time.
You get things done. What we need:
Experience with on-demand services, last mile logistics or supply chain
1-2 years of work experience in an engineering environment
Business or engineering degree is preferred
Prior experience with JIRA and Confluence is preferred
Prior experience with databases and working with data
Demonstrated skills to document, illustrate and present product ideas to various audiences
Excellent interpersonal and communications skills
Demonstrated high-quality planning and organizational capabilities
You are able to tell a bad joke and improve it
Good team player, self-motivated, and strong leadership skills",https://www.indeed.hk/rc/clk?jk=1c6fbe089f0d99e4&fccid=0c4d265f75ba7913,https://jobs.lever.co/lalamove/185658cb-6346-44bb-a638-db9c530c5fdb,nan,nan,nan,nan,nan
1514871688.0,2018-01-02 13:41:28,a267837bbf9e59ff,Research Assistant or Associate Scientist,Avalon PolyTom (HK) Limited,"Sha Tin, New Territories",30+ days ago,"Avalon Polytom (HK) Limited (the “Company”) is a small biotech company focusing on protein therapeutic drug R&D. We apply our technological edge to downstream health products. Our products utilize proprietary and patented formulation approach to improve the safety, efficacy and versatility of the therapeutic proteins, as compared with marketed products. The management team of our group (the “Group”), in which the Company is a group member, comprises well-seasoned biotechnology experts and business professionals with global experience.The Company is currently seeking a junior Research Assistant or Associate Scientist who is willing to take up the challenge in a fast growing company and interested in start-up operations in the biomedical field.Primary responsibilities: Design and execute study protocol including relevant bio-analyses;Work independently or with a team to develop biotherapeutics;Follow through any government-funded project, and liaise with our Group, CMOs, CROs and other collaborators in pre-clinical activities;Prepare study report and patent application;Present project update to R&D management team;Assist and support other staff as and when necessary and appropriate; andHandle any other relevant responsibilities and/or functions of our Group, as assigned from time to timeRequirements/Qualifications: To be an ideal candidate in this role, the individual shall be able to perform each essential duty satisfactorily. The list below is representative of the knowledge, skill, ability, and/or personal attributes required to be an ideal candidate:Graduates with Bachelor, Master or Ph.D. degree in chemistry, biochemistry or molecular biology; two years of industrial experience is a plus;Candidate with experience in studying protein science using HPLC and mass spectrometry;Candidate with experience in protein expression and purification;Candidate with experience in basic bio-analytical tools such as ELISA, enzymatic assays, cell-based assays and real-time PCR;Candidate who is proficient in written English;Candidate who is organized, reliable and efficient;Candidate having strong sense of responsibility and able to meet tight deadline with high quality;A team player with positive attitude, self-motivated and detailed-minded;Candidate who is proactive and is able to prioritize and to manage multiple tasks;Candidate who is mature and results oriented with international mindset and strong personal drive to take initiative and get things done;Candidate who has good presentation and persuasion skills;Candidate who has strong ethics, integrity, and credibility; andCandidate who is discreet and with good judgment in handling/responding to confidential and sensitive informationInterested candidates should apply in confidence with date of earliest availability, and current & expected salary.Personal data provided will be used for recruitment and related purposes only and strictly in accordance with the relevant Personal Data Policy for Employment. Applicants who are not contacted within 6 weeks may consider their application unsuccessful and the personal data collected will be destroyed in due courseJob Type: Full-time",https://www.indeed.hk/company/Avalon-Genomics-(HK)-Limited/jobs/Research-Assistant-or-Associate-Scientist-a267837bbf9e59ff?fccid=501acf4cd5f63470,https://www.indeed.hk/cmp/Avalon-Genomics-(HK)-Limited/jobs/Research-Assistant-or-Associate-Scientist-a267837bbf9e59ff,nan,nan,nan,nan,nan
1514871688.0,2018-01-02 13:41:28,7cc1d0d953898abf,Senior Mobile iOS Developer,Seekers Capital,Hong Kong Island,30+ days ago,"The key responsibilities of the team are:
Research and prototyping with newest mobile technology
Development of both reusable software components and libraries as well as consumer facing mobile applications
Setting the standards and best practices
Work in close collaboration with a dynamic team of top technologists, scientists, traders as well as external stakeholders
Key Qualifications
Strong Objective-C/Swift and Cocoa Touch knowledge
Strong CS fundamentals - especially object oriented design
Strong analytical problem solving skills using scientific method and design of experiments
Real passion for learning new technologies
Ability to work in an evolving environment, helping to develop processes and best practices for both company and industry
Excellent written and verbal communication skills, able to communicate complex technical issues to cross-functional teams
Excellent collaborator, able to make a positive contribution in a dynamic team spread around the world
Self motivated, able to work independently, entrepreneurial, excellent time management
Fun loving personality is crucial
Desirable Expertise
Experience in advances iOS frameworks: Core Data, MapKit, Networking, UIKit, CoreAnimation, CoreText, REST APIs
Experience programming for UX
One app in the Apple App Store
Knowledge of mobile web (e.g., HTML, CSS, JavaScript)
Knowledge of Android
Very competitive compensation package including medical insurance plan, discretionary bonuses, 5-days week, startup culture.
Interested candidates, please submit your resume. All information will be treated as strictly confidential.",https://www.indeed.hk/rc/clk?jk=7cc1d0d953898abf&fccid=2d8cc33f880ba663,https://seekerscapital.jobsoid.com/j/7031/senior-mobile-ios-developer?source=indeed,nan,nan,nan,nan,nan
1514871688.0,2018-01-02 13:41:28,04d0c18bf75eab17,Scientist,Aptorum Group,"Hong Kong Science Park, New Territories",17 days ago,"The appointee will be responsible for pharmaceutical R&D work, including experimental design, laboratory equipment operation, sample preparation and characterization, data analysis, performance testing, drafting reports, SOP and IP documents.Responsibilities and DutiesNew drug formulation developmentPrepare R&D prototypes, initiate stability studies and monitor results for specification compliance and product improvementResearch technical information on new or existing raw materialsPhysical testing and evaluation of R&D products as requiredHands-on experience testing the identity of chemical ingredients using HPLC, GC, LC-MS/MSProvide technical and troubleshooting assistance to the R&D groupMaintain accurate and detailed documentation of R&D product development projectsEvaluate chemical and physical properties of new raw materials and make recommendations for approvalWorking closely with other assigned researchers in designing and building theoretical formulationsTo handle any other relevant responsibilities and/or functions of the Company or the GroupReporting to the senior project manager or any other appropriate staffQualifications and SkillsMaster (MPhil: >4~5 year) or PhD degree in Chemistry, Pharmaceutical Science, Bio-Medical Engineering, Materials Sciences, Molecular Biology, Biochemistry, Biomolecular/Chemical Engineering or related disciplines;Hand-on experiences in various types of R&D work;Good command of English and Chinese, articulate report writing/presentation skills as well as abilities in literature/patent search;Self-motivated, work independently and able to communicate in teamwork;Positive, analytical, critical thinking and good troubleshooting skill;Have a sense of ownership for his/her work;Willing to work under pressure;Immediate available is highly preferred.BenefitsWe offer an attractive remuneration package including 5-day work week, guaranteed 13th month payment with discretionary bonus and medical plan to the right candidate.Job Type: Full-timeRequired education:Master's",https://www.indeed.hk/company/Aptorum-Group/jobs/Scientist-04d0c18bf75eab17?fccid=e0379adee75a8242,https://www.indeed.hk/cmp/Aptorum-Group/jobs/Scientist-04d0c18bf75eab17,nan,nan,nan,nan,nan
1514871688.0,2018-01-02 13:41:28,e11b7002a9d62998,Senior Java Developer,Seekers Capital,Hong Kong Island,30+ days ago,"In this role as a Senior Java developer, you will join a dynamic team to build a quantitative research platform and its supporting infrastructure including trading components. Multiple new roles are open from Junior to Senior levels.

Responsibilities:
In this role, you are responsible for the greenfield development of a quantitative research platform and trading components to support business growth and are expected to:
Participate in the entire software development lifecycle including design, implementation, testing, deployment, and support
Ensure consistent delivery of software releases and hand-over to end-users
Work along-side the existing ecosystem of latency-sensitive in-house and commercial trading technologies
Work in close collaboration with a dynamic team of top technologists, scientists, traders as well as external stakeholders

Basic Qualification:
Open to all levels of software development experience.
BSc / MSc / PhD in Computer Science or related degrees
Highly knowledgeable in one or more of the following languages: Java / Scala/ Golang (Go) / C++
Operational knowledge in one or more of the following: Python, Git, JavaScript, MySQL, Bash scripting, Linux
Clear understanding of algorithms and data structures
Experience in both infrastructure backend and frontend web development
Basic understanding of trading operations or technologies (desirable)
Mathematically-inclined mind with an analytical approach to problem solving
Ambitious, self-motivated, resourceful technology enthusiast

Desirable expertise, at least one:
Event-driven distributed systems
Microservices
Data analytics
Modern web-stacks
User interfaces
Test engineering
Full SDLC, Scrum, TDD, Extreme Programming
DevOps
Very competitive compensation package.
Medical insurance plan, discretionary bonuses, 5-days week, startup culture.
Interested candidates, please submit your resume. All information will be treated as strictly confidential.",https://www.indeed.hk/rc/clk?jk=e11b7002a9d62998&fccid=2d8cc33f880ba663,https://seekerscapital.jobsoid.com/j/6840/senior-java-developer?source=indeed,nan,nan,nan,nan,nan
1514871688.0,2018-01-02 13:41:28,1a9cc0d4d5666c36,Data Scientist / Data Analyst,GoGo Van,Hong Kong,,"What you'll be doing:
Create key insights and recommendations through quantitative analysis.

Develop tools for tracking, analyzing and reporting data from multiple sources and for diverse business needs.

Provide recommendations to the management and product team.

Build automated models and visualizations tools to uncover patterns, optimize service offering and improve business model.

Guide, oversee and interpret experiments.

What we're looking for:
Prior experience working with data.

Strong quantitative or engineering background.

Ability to code (preferably Python).

Good knowledge of SQL.

Familiarity with tools and libraries for data analysis.

Fast learner, enjoying solving problems using cutting edge technology.

Good communication skills.

Awesome if you have those:
Interest in logistics problems and geographic data.

Experience in machine learning or operational research.

Data visualization (knowledge of Javascript and libraries like d3.js is an advantage).

Ready to be part of the team? Apply for this position by submitting your CV to [email redacted, apply via Jobable]

GOGOVAN does not accept unsolicited resumes, CVs or applications from third party staffing or recruitment agencies. All unsolicited submissions will be considered free referrals.",https://www.indeed.hk/pagead/clk?mo=r&ad=-6NYlbfkN0A7v-6roX7o4cHPDdAbXJHAFAZif8l77VjStNNHmuXG_yHtlkQKH89P7pQc9XmLOKgrrqn2rcJxaplfnylOKbfkJl1tQLJfBr99cMOGOL_Gs_zjkfuO-yXbnOhuSvVvZ0hiTYfUUAOC9_O_RYIgWv936jgDQsnkP0gxtvGxJoJpqJv9vNWLM9JnrWAc60Rw0A8UQPYGHA2nAN7EbEqP0FcMt5ciVATVzXfE0lyQc7ZQXpMb643JoYepBjJa5htj-e5BWxe55gKdR06JLb7rGqIwp7YH_JB9W3Q1lUJA3CMXsEdouk1ONybE0m35te4oAXvzT3On_HxqqHWGAzXMZv7UrheBkhsdVm664WR4fvfq_2ZAib4Hb87nf7Fq35V62_i6TRb9YYlFCkDOIvRe4KNY3IF7WW7_uvqRIBynYIMkGi0LrMrNPQpVuXv8y7zZE3GLRpcMQfifAnWc9vdt0HhNAZ-Lz8oPMc7Q3j6uNTHrz4pbwq-GyfVB43zbnkBekqRoJrYW6OM8wVLO1eFvUVT28hinrOwL8DDdn7YEEwoxtB7-McHeeW9hHwo0eTQncMukLwfXehuoTmQ3BzyTI_OgoRk3HkX3rTnqZ2l-rEubjWGZ1hLxA-RkGoJHxs_p7nY=&p=5&sk=&fvj=0,https://www.jobable.com/gogo-van-jobs/hong-kong/data-scientist-data-analyst-185278?utm_source=Indeed&utm_medium=cpc&utm_campaign=Indeed,nan,nan,nan,nan,nan
1514871688.0,2018-01-02 13:41:28,193906d35ace58a1,Technician / Research Assistant,Novoheart,"Sha Tin, New Territories",30+ days ago,"Technician / Research AssistantNovoheart LimitedWith operations in the US, Canada and Hong Kong, Novoheart is a global stem cell biotechnology company listed on the Toronto and Germany Stock Exchanges. The company is dedicated to engineer bioartifical human heart prototypes using state-of-the-art stem cell and bioengineering approaches. We are seeking highly motivated individuals to join us as one of our professional associates at our site at the Hong Kong Science & Technology Park with a newly renovated state-of-the-art facility of ~6,000 sq ft.Responsibilities: Participate in research projects involving basic techniques such as cell culture, real time PCR, immunohistochemistry and Western blottingAssist scientists in data collection and data analysisUndertake any other duties as assigned.Qualification and requirements: Bachelor’s degree or above in Biological Sciences or a related disciplineHave laboratory experience, preferably in human stem cell / tissue culture and/or molecular biology (for technician: Minimum 2 years experience)Excellent ability to communicate in English (spoken and written)Fresh graduates will also be consideredInterested candidates please apply by clicking the button ’APPLY NOW’ button.Job Type: Full-timeRequired education:Bachelor'sRequired language:English",https://www.indeed.hk/company/Novoheart/jobs/Technician-193906d35ace58a1?fccid=ed07353a5e835e0d,https://www.indeed.hk/cmp/Novoheart/jobs/Technician-193906d35ace58a1,nan,nan,nan,nan,nan
1514871688.0,2018-01-02 13:41:28,0751ea0ba886b0be,Others - Data Science Instructor,WHub,Hong Kong,18 days ago,"Full time


Hong Kong


Others


starting date : 2018-01-08


Accelerate can provide a visa.


Description


Accelerate was founded with the mission of bridging the talent gap in Hong Kong. We enable our students to acquire the skills they deserve and forge the career of their dreams. Our programs are accessible: our ""Zero Tuition Until Hired"" model opens the door to software engineering and AI for many. We are accountable: Your success as a student is our success as a platform. We are a community: By joining an Accelerate course, you will walk away with both valuable knowledge and relationships to take your career forward.


We are currently looking for a Data Science & Machine Learning instructor as we are launching Asia's first Full-Time Immersive Zero Tuition Until Hired AI Bootcamp!


Required Skills

Strong programming skills in Python, NumPy.
Experience in NLP, Computer Vision and Reinforcement Learning is required.
Experience in using TensorFlow and PyTorch is a must.
Experience using Deep Learning frameworks such as Tensorflow, PyTorch.
Good to have

Degree in Computer Science or a related field.
Candidates with advanced degrees in related disciplines will be preferred.
3+ years of experience as Data Scientist/Machine, Learning Engineer/ Deep Learning.
Previous experience as educator and/or training provider will be preferred.
Fluent written and spoken English.
Personality

Alignment with our goal to help those who are passionate about technology but unable to find the right avenue.
Appreciating feedback to improve curriculum material.
Strong interest in state-of-the-art technology.
Ability to work as part of a team.
Open to new ideas.
Passionate about adult learning and education.
You will be teaching our Data Science & Machine Learning, Deep Learning courses.


We may also require occasional work on ad-hoc in-house projects.


You will also be asked to partake in external events to promote our courses and brand.


Salary

Equity part is negotiable.


Salary range / month : Negotiable


WHubber factors
Startups have different perks to offer to talent. Here is their allocation of 100 points.


Flexible Role and Responsibility


Impact on Society


Compensation


Flexible hours


Impact on Society35


Created on: 2017/12/14


about Accelerate",https://www.indeed.hk/rc/clk?jk=0751ea0ba886b0be&fccid=eb9b4575af3a03e4,http://whub.io/startups/accelerate/jobs/others-data-science-instructor-1513242057,nan,nan,nan,nan,nan
1514871688.0,2018-01-02 13:41:28,09a1cdff93c2fa8a,Junior Data Scientist - Quantitative Trading,Aoling Investments,"Wong Tai Sin, Kowloon",30+ days ago,"A small proprietary trading firm based in HK specialised in high frequency trading and quantitative trading is looking for talents to expand its quantitative research team.MS or PhD candidates in quantitative disciplineStrong statistical and mathematical modeling skillAbility to write R/Python, skillful in Excel/VBAInterested candidates please apply via APPLY NOW .Job Type: Full-time",https://www.indeed.hk/company/Aoling-Investments/jobs/Junior-Data-Scientist-09a1cdff93c2fa8a?fccid=b074ec722a8c0d4b,https://www.indeed.hk/cmp/Aoling-Investments/jobs/Junior-Data-Scientist-09a1cdff93c2fa8a,nan,nan,nan,nan,nan
1514871688.0,2018-01-02 13:41:28,e1ac2bfffaa13cd7,DevOps Engineer @ T1,Terminal 1,Hong Kong,29 days ago,"Job Summary!! Apply at: tty1.us/tty1-indeed !!We are Terminal 1 , a recruiting technology firm that hires software builders to both recruit and build automated recruitment tools. Our recruiters are highly skilled software engineers, product designers, and data scientists with strong technical skills and a network in their industry.As a junior software engineer, you'll be asked to:Implement development tools for testing automationWrite automated testsManage and maintain CI systemSupport the team on technical issues dailyPrioritze and resolve internal issuesMaintain other internal systemsHard Requirements:Solid Linux experienceAWS/Cloud computing experienceExpertise in at least two programming languages (Shell, Perl, PHP, Java, Python, JavaScript, Ruby, Erlang etc.)CI tools experience preferred (Jenkins/Travis)Docker/Kubernetes experience preferredSoft Requirements:Must be able to work independentlyExperience in an agile team is preferred!! Apply at: tty1.us/tty1-indeed !!Job Type: Full-time",https://www.indeed.hk/company/Terminal-1/jobs/Devop-Engineer-e1ac2bfffaa13cd7?fccid=f3285d5bddb5d799,https://www.indeed.hk/cmp/Terminal-1/jobs/Devop-Engineer-e1ac2bfffaa13cd7,nan,nan,nan,nan,nan
