epoch,scrping_dt,ad_id_indeed,ad_jobtitle_indeed,ad_cie_indeed,ad_jobloc_indeed,ad_post_dt_indeed,ad_jobdes_indeed,search_ad_url,ad_url,ad_jobdate,ad_jobtitle,ad_jobcie,ad_jobdes,ad_email
1514871688.0,2018-01-02 13:41:28,780b1d48dc5545f9,Data Scientist [Ref. CLPH-I-DS],CLP Holdings Limited,Hong Kong,17 days ago,"Founded in 1901 as China Light and Power Company Limited in Hong Kong, CLP Group has grown from a Hong Kong-based power utility into a leading investor and operator in the Asia Pacific Regions electricity market. Outside Hong Kong, CLP invests in the energy sector in Mainland China, India, Southeast Asia, Taiwan and Australia. Our business includes power generation, transmission and distribution, and electricity and gas retail activities. CLP Holdings Limited, a company listed on the Stock Exchange of Hong Kong, is the holding company for the CLP Group.

We are looking for a high caliber individual to join Innovation. Key responsibilities include:

The Position Profile:
Contribute to analytics team to develop different tasks regarding the modeling processes lease provide

Deep understanding of business area processes and expectations and the way they are going to use the model outcomes

Define the project implementation process, ensuring it meets business needs and expectations

Follow the methodology designed for every specific analytics business solution. Apply the techniques and algorithms defined in the methodology and contribute to prepare the solution deliverables

Focus on data preparation, data cleansing and data audit. Build analytics models according to the defined methodology

Contribute to prepare the deliverables, according the project requisition

Contribute to the implementation process, both on existing business apps and creating and developing new applications that meet business needs

Contribute to productionalize the solutions deployed, ensuring they can be replicable and re-usable by other business areas and overseas

Contribute to maintenance, and updates of every solution deployed, ensuring model performance and model value at all the time

Requirement:
A recognized university degree in Statistics, Mathematics, Computer Science or other relevant disciplines

Candidates should have a Minimum of 5 years relevant experience in data science domain

Used to work with big data technology

Strong analytical and interpersonal skills

Good featuring engineering, analytical and problem-solving skills

Able to work independently when neccesary

Capability to communicate effectively at all levels in both spoken and written English

Please apply by sending email to [email redacted, apply via company website] giving a detailed C.V., including career history, major achievements and personal attributes on or before 23 December 2017.

Important: To facilitate our easy tracking please use a unique file name for all attachments and your email subject box in this format: CLPH-I-DS_Last Name_First Name_Other Names

Applicants not invited for interview within 6 weeks from the closing date may assume their applications unsuccessful.

Information provided will be for recruitment purpose within the CLP Group and only short-listed candidates will be contacted. We comply with all applicable laws and regulations of HKSAR in handling applications. For details of the Personal Information Collection Statement, please visit our website: http://clp.to/engPICS.

For further information on our company, please visit our website: https://www.clpgroup.com/

Information Classification: PROPRIETARY",https://www.indeed.hk/rc/clk?jk=780b1d48dc5545f9&fccid=b8503029e9535cb9,https://www.ctgoodjobs.hk/english/search/joblist.asp?tag_job_id=04869090&tag_job_id_display=Y&utm_source=04869090&utm_medium=indeed_2078&utm_campaign=indeedorg_feed,nan,nan,nan,nan,nan
1514871688.0,2018-01-02 13:41:28,ef18711bd68cd9fe,Post-doctoral Fellow,The University of Hong Kong 香港大學,"Pok Fu Lam, Hong Kong Island",28 days ago,"Applications are invited for appointment as Post-doctoral Fellow in the Laboratory for Space Research (LSR) and the astrophysics research group of the Department of Physics , to commence as soon as possible, for a period of three years.


The multi-disciplinary LSR focuses on the analysis and interpretation of a wide variety of existing and planned space-based data in the public domain, supplemented by specific missions to which HKU scientists have privileged access. The Department’s existing astrophysics expertise is mainly in studies of late stage stellar evolution, including post-AGB stars and planetary nebulae, and supernova remnants. Expertise here will be very highly regarded.


Applicants should have a Ph.D. degree; ability to demonstrate a strong research track record including refereed publications in top journals; excellent communication and interpersonal skills, and research leadership; capacity to work independently and in a team; and ability to supervise Ph.D. students. Experience with space-astronomy missions in terms of winning time and publishing related papers will be desirable. For enquiries about the existing research activities of the Department and the specific job requirements, please write to Professor Quentin Parker, Associate Director, LSR (fax: (852) 2559 9152 or e-mail: quentinp@hku.hk ).


A highly competitive salary commensurate with qualifications and experience will be offered, in addition to annual leave and medical benefits.


Applicants should send a completed application form, together with an up-to-date C.V., a detailed publication list and a research proposal to Professor Quentin Parker (e-mail: quentinp@hku.hk ). Please indicate clearly the reference number in the subject of the e-mail. Application forms (341/1111) can be downloaded at http://www.hr.hku.hk/apptunit/form-ext.doc . Further particulars can be obtained at http://jobs.hku.hk/ . Closes January 31, 2018 .


The University thanks applicants for their interest, but advises that only candidates shortlisted for interviews will be notified of the application result.",https://www.indeed.hk/rc/clk?jk=ef18711bd68cd9fe&fccid=381c9d5f6b782096,http://jobs.hku.hk/jd.php?id=201701653,nan,nan,nan,nan,nan
1514871688.0,2018-01-02 13:41:28,06c3ccd7fd92b942,Administrative Assistant,SagaDigits Limited,"Central and Western, Hong Kong Island",30+ days ago,"Job SummarySagaDigits has been helping clients in all aspects of business in HK, PRC and globally. Our team comprises of professional Big Data engineers, data analysts in Marketing and data scientists. We have strong expertise in Big Data, Artificial Intelligence and machine learning, planning enterprise resources in the most effective way. Our Big Data engineers have solid background in business data mining experience and strong statistics skills to help build a sturdy data base for business analysis.We are looking for an Administrative Assistant to help our team make a big impact platform. The position performs administrative functions in supporting to achieve the department's objectives. Work is generally varied and administrative or project oriented. This position requires an organized, detail-oriented person with knowledge of customer support, accounting or online web applications. The candidate will work with the big data team, to provide Big Data applications such as Data Visualization, Indoor Positioning, and Shopping Mall systems.Responsibilities and DutiesAnswer customer support telephone line(s); provide callers with responses to all types of requests, both routine and those requiring research and follow-up; direct calls to the appropriate person or take messages.Reconcile transaction accounts as reflected on the distribution summary or operate statement for our big data platforms.May perform data entry into a mainframe application.May develop databases or spreadsheets.May responsible for presenting information to a group.Develop alternatives to handle requests when many times the problems are not clearly identified or involve sensitive issues.Regular respond directly to the caller after performing research or follow-up.Compose all types of correspondence or documents, always on behalf of the supervisor. Correspondence may be directed toward outside owners, customers or senior level executives.May process data through an automated system. This may include processing items such as expense reports, accounts payable, payroll and personnel data.Perform research and follow-up necessary to solve problems.May identify areas where new administrative policies and procedures may be necessary within a department.Research questions and problems regarding departmental or administrative policies, procedures, information or services, including questions, which are complex in nature.Research typically requires obtaining data from multiple sources.May have responsibility for a specific departmental process/system, which entails research, and analytical responsibilities.Qualifications and SkillsExperience as an Administrative AssistantAdvanced level proficiency with Microsoft Office applications (specifically, Outlook, PowerPoint, Excel, and Word)Need to be able to effectively communicate with all levels of managementNeed to be able to effectively communicate with different clientsNeed to be able to work multiple tasks with limited supervisionJob Type: Full-time",https://www.indeed.hk/company/Catchtop-Limited/jobs/Administrative-Assistant-06c3ccd7fd92b942?fccid=acebc17c741beb03,https://www.indeed.hk/cmp/Catchtop-Limited/jobs/Administrative-Assistant-06c3ccd7fd92b942,nan,nan,nan,nan,nan
1514871688.0,2018-01-02 13:41:28,ccc082ce4234203c,Innovation and FinTech Partnerships Vice President,JP Morgan Chase,Hong Kong,18 days ago,"About J.P. Morgan Corporate & Investment Bank
J.P. Morgan’s Corporate & Investment Bank is a global leader across banking, markets and investor services. The world’s most important corporations, governments and institutions entrust us with their business in more than 100 countries. The Corporate & Investment Bank provides strategic advice, raises capital, manages risk and extends liquidity in markets around the world.
Who we are
The FinTech & In-Residence team is part of J.P. Morgan’s ecosystem of passionate engineers, product developers, designers, data scientists, and business people set on creating and building products that transform the way we and our clients do business.
We look after J.P. Morgan’s FinTech strategy and run our In-Residence program, which was created to identify and partner with leading emerging companies, investors, and thought leaders to foster innovation.
Why join?

This is a fascinating time, as new client needs, technologies and business models are emerging with the potential to radically transform financial services. You will be at the leading edge inside the company driving change. Reporting to the Head of In-Residence globally, you will:

External Engagement

Expand the In-Residence program to APAC and raise awareness by attending credible industry events and forums

Strategically analyze the FinTech market to identify, engage and manage a portfolio of external partners with emerging technology and capabilities
Internal Stakeholder Engagement

Partner with senior leaders in Markets, Banking and other functions to understand existing challenges and opportunities for FinTech support

Educa te internal key stakeholders in the region on In-Residence program
FinTech Vetting, Onboarding, and Management

Build out and critically assess the end to end operations capable of onboarding a start-up from first meeting through to production in APAC

Project manage APAC In-Residence engagements, working with; technology, product, sourcing, business, strategic investments, compliance and op erations to ensure successful migration from co-creation into production Skills we are seeking

Intellectually curious, see things differently, and questions the norm

Passion for creative problem solving and an entrepreneurial spirit

Ability to rapidly understand emerging technologies and business models to draw connections to our businesses and clients’ needs

Capacity to deconstruct business challenges into core needs which can be addressed by creative partnerships

Capacity to filter a large number of external engagements into the most impactful opportunities

Commercially-minded with a demonstrated ability to build and manage specific partnerships and bring them to fruition

Strong communication/presentation skills (i.e. creating content) that can be consumed at all seniority levels with both internal and external audiences

Professional experiences (typically 7+ years) that will set you apart

Successful track record of building and managing a network of partnerships within the financial services or FinTech industry

Keen understanding of the FinTech sector and established relationships with start-ups, VCs, angel investors, incubators, accelerators and academia

Experience with product development and/or business development, in particular within financial services

Member of an Innovation/Partnership team within a large organization or experience at a startup a plus

Knowledge of the Corporate and Investment Bank

Knowledge of emerging technologies such as distributed ledger, data science and cyber as well as exposure to design-based thinking
Interested?
Send us your resume, LinkedIn profile, and/or twitter handle, as well as two to three interesting startups that caught your eye recently and why.",https://www.indeed.hk/rc/clk?jk=ccc082ce4234203c&fccid=c46d0116f6e69eae,http://jobs.jpmorganchase.com/ShowJob/Id/22106/Innovation%20and%20FinTech%20Partnerships%20Vice%20President,nan,nan,nan,nan,nan
1514871688.0,2018-01-02 13:41:28,2fec2995624125da,Data Scientist / Computational Scientist,Cluster Technology Ltd,Hong Kong,30+ days ago,"Solving practical problems by using computational skills and cross-category approaches of data mining/statistics/artificial intelligence/mathematical optimization;

Utilize user characteristics and behavior data, financial data to do data mining and model building analysis;

Participate in client research to collect users’ need, prepare reports of clients’ behavior analysis;

Be required to travel to mainland on a need basis.

Requirements

Major in Computer Science, Engineering, Statistics or related disciplines;

1-2 years hands on relevant working experience;

Good at analytical thinking with solid mathematics knowledge;

Good master of foundation theories and approaches of data mining or statistics field;

Proficiency in Java, Python, R or at least one programming language;

Knowledge on data structure and algorithm;

Experience on processing mass data, model building, and product improvement by mathematical approach is preferable;

Knowledge on MYSQL,ORACLE database operation with excellent tuning skills is an advantage;

Knowledge on machine learning or statistics field with experience on data mining projects is preferred;

Team spirit, proactive in idea sharing with good communication skills (Chinese and English);

Preference will be given to candidates with high integrity, team spirit, strong sense of responsibility, and passion for the application of modern computing technology in China.

Basic Benefits

Benefits & Job application method - 香港 Hong Kong HK

We offer competitive remuneration package including 5-day work and 15 days annual leave to the right candidate with excellent career advancement.

Application Method:
Interested parties please apply with detailed resume (in MS Word / PDF Format), stating current and expected salary to recruit@clustertech.com , or post to:

The Human Resources Department,

Units 211-213, Lakeside 1,

No. 8 Science Park West Avenue,

Hong Kong Science Park,

Shatin, New Territories, Hong Kong

All applications will be treated in strict confidence. Personal information collected will be used solely for the purpose of recruitment. If you are not invited for an interview within 4 weeks, your application will be filed for a further 2 years and be considered for any other appropriate positions within the company or related companies.",https://www.indeed.hk/rc/clk?jk=2fec2995624125da&fccid=f1943ec5b4031bab,https://www.clustertech.com/Career/Job-Opportunities/Data-Scientist-Computational-Scientist,nan,nan,nan,nan,nan
1514871688.0,2018-01-02 13:41:28,76fcc2113267d777,Senior Data Manager (Data Scientist),Bank of China (Hong Kong),Hong Kong,30+ days ago,"Responsibilities:

Develop algorithms and statistical predictive models to identify business challenges and opportunities, and support developing business strategies
Analyze structured and unstructured data, visualize findings, discover insights and propose new business models
Collaborate with business users and IT to ideate and introduce new data science innovations into business areas such as UX / UI, marketing and risk management

Requirements:

Degree or above in Mathematics, Statistics, Computer Science or relevant disciplines
5+ years' experience relating to data analytics, with at least 3 years in data mining, statistical modeling, predictive analytics, machine learning or data science related work
Proficiency in Python, R, or other statistical / data science language
Experience with statistical modeling tools and data visualization tools
Banking or Financial Services industry experience preferred
Strong analytical mindset and problem solving skills
Excellent communication and presentation skills with good command of English and Chinese in both spoken and written, including Putonghua
#LI",https://www.indeed.hk/rc/clk?jk=76fcc2113267d777&fccid=b8acaded554ab64d,http://careers.pageuppeople.com/798/cw/en/job/494626/senior-data-manager-data-scientist,nan,nan,nan,nan,nan
1514871688.0,2018-01-02 13:41:28,91942adc42f2a909,Frontend Developer @ T1,Terminal 1,Hong Kong,29 days ago,"Job Summary!! Apply at: tty1.us/tty1-indeed !!We are Terminal 1 , a recruiting technology firm that hires software builders to both recruit and build automated recruitment tools. Our recruiters are highly skilled software engineers, product designers, and data scientists with strong technical skills and a network in their industry.You'll work with product and UI designers to build a user friendly modern webapp.Implement UIs using clean and robust HTML , CSS , and javaScript on a modern tech stack (Vue.js).Work with a great team to quickly iterate on product design and feature developmentHard Requirements:Expertise in HTML and CSS, including pre-processors and frameworks. (Sass, postCSS, bootstrap, etc)Experience programming with Javascript and modern frameworks (Vue, React, Angular)Proficient with build tools and navigating the NodeJS ecosystem (Webpack, gulp, npm, etc)Knowledge of JS testing frameworks like Jasmine and JUnitSoft Requirements:Strong attention to detail, prides themselves on delivering polished UIsGreat team player - can work on agile teams and communicate effectively with designers and other team members!! Apply at: tty1.us/tty1-indeed !!Job Type: Full-time",https://www.indeed.hk/company/Terminal-1/jobs/Frontend-Developer-91942adc42f2a909?fccid=f3285d5bddb5d799,https://www.indeed.hk/cmp/Terminal-1/jobs/Frontend-Developer-91942adc42f2a909,nan,nan,nan,nan,nan
1514871688.0,2018-01-02 13:41:28,dc3cc95a052537f8,"Machine Learning Specialist (Fintech), overseas training",Ambition,Hong Kong,30+ days ago,"Contract Type:
Permanent

Specialisation:
Technology

Salary:
Negotiable

REF:
BBBH215787_1509525287

Bond Sze

Machine Learning Specialist (Fintech), overseas training

Location:
Hong Kong, Hong Kong

Contract Type:
Permanent

Specialisation:
Technology

Salary:
Negotiable

REF:
BBBH215787_1509525287

Bond Sze

Email Bond

View Bond's other roles

This is an amazing opportunity to work with top scientists in Machine Learning and apply in real world.
A high-profile Fintech is developing a cutting-edge Machine Learning Technology to change the financial market.
A very attractive package will be provided.

Duties
Building analytical models to work with structured and unstructured data
Identify research findings and scale up to business usage standard
Generate analysis derived from enormous market data

Qualifications
Post-graduate qualifications with strong knowledge in Natural Language Processing
Strong data extraction abilities using Python
Familiar with Big data technologies like Kafka, Hadoop, Elastic Search
Very strong proficiency in Mandarin and English

Interested parties please apply directly, email or call Bond Sze at 3103 4344 for a confidential conversation. Data provided is for recruitment purposes only.

LI-IT",https://www.indeed.hk/rc/clk?jk=dc3cc95a052537f8&fccid=c9cd3dc1c74035d6,https://www.ambition.com.hk/job/machine-learning-specialist-fintech-overseas-training/?utm_source=IndeedOrg?utm_source=Indeed&utm_medium=organic&utm_campaign=Indeed,nan,nan,nan,nan,nan
1514871688.0,2018-01-02 13:41:28,39a6261bdf3f1592,Senior Data Analyst / Data Scientist,Conners Recruitment,Hong Kong,30+ days ago,"Responsibilities

Responsible for the implementation of big data analytics projects
Collaborate with business users and IT to ideate and introduce new data science innovations into business areas
Build automated models and visualizations tools to uncover patterns, optimize service offering and improve business model
Generate reports and present key insights to management with actionable recommendations

Requirements

University graduate, preferably major in Quantitative Analysis, Statistics, Decision Science, Mathematics or Computer Science
Minimum of 5 years’ experience in data mining &/or machine learning; Banking experience a plus
Experience working with complex customer data from multiple sources, database marketing and database management
Proficiency in using of analytical tools such as SAS, R, Python, etc
Able to work independently, creative and detail-oriented
Excellent communication and interpersonal skills in English and Chinese

To apply, please send your detailed resume or contact Ernest WU at 2851 7763 for a confidential discussion.


Only shortlisted candidates will be notified.


All data collected will be used for recruitment purpose only & will be used strictly confidential.


Conners Consulting Limited


2005 Kai Tak Commercial Building 317 Des Voeux Road Central Hong Kong


Tel: (852) 3996 8090


Website: www.connersconsulting.com",https://www.indeed.hk/rc/clk?jk=39a6261bdf3f1592&fccid=5f9b20609e6ef115,http://connersconsulting.com/sector/?jrd=1&jobid=1880,nan,nan,nan,nan,nan
