epoch,scrping_dt,ad_id_indeed,ad_jobtitle_indeed,ad_cie_indeed,ad_jobloc_indeed,ad_post_dt_indeed,ad_jobdes_indeed,search_ad_url,ad_url,ad_jobdate,ad_jobtitle,ad_jobcie,ad_jobdes,ad_email
1514871688.0,2018-01-02 13:41:28,4f0d9e2c1f836f60,Senior Customer & Business Analytics Officer,AXA General Insurance,Hong Kong,30+ days ago,"Senior Customer & Business Analytics Officer (1700065U)


Primary Location
: HONG KONG

Organization
: AXA Hong Kong Life and General Insurance

Contract Type
: Regular

Description


Big data/ Data Modelling
Innovate & develop predictive models and statistically rigorous advanced model scripts to support data science & analytics initiatives on machine learning/ deep learning
Perform advanced analysis using statistical techniques & algorithms to facilitating effective targeting, segmentation, and identification of opportunities around cross-sell / up-sell, retention and marketing program optimization
Ability to perform the big data analytics processes on massive data sets from different data sources: explanatory and targeted data analyses, generate and test working hypotheses, analyze historical data and identify features & signals
Captures, tracks and dynamically diagnose models-in-use for effectiveness (e.g. Gradient boosting tree, Random forest, Neural Network etc.)
Work with business partners and external vendors / partners on acquiring and compiling new external data sources for the enrichment of big data analytics database
Manage BI solution development and implementation for various MI reporting (e.g. Tableau)
Customer Insights into business application

Commercialization of insights from data scientists under a customer-centric, need-based context and turn into campaign opportunities to business lines and distribution models
Project Management

Adhoc strategy projects covering big data platform development, customer segmentation, customer campaigns, business strategy reviews etc

Qualifications

Graduate or advanced degree qualifications in quantitative related subjects (e.g. Statistics, Maths, Engineering, Actuarial, etc).
2-3 years of relevant working experience in data analytics field as statistician / analyst / data scientist
Good knowledge of predictive modelling, big data analysis, and data science projects: machine learning, statistical modeling, and data mining techniques & algorithms (e.g. logistic regression, linear regression, random forest, neural network, cluster analysis, time series, survival analysis etc.)
Solid experience in scripting/programming language like Python, R, SAS, SQL
Familiar with Hadoop, Hue, Spark, HIVE and any BI tool (e.g. Tableau) will be advantage
Previous exposure to / knowledge of insurance industry will be an asset
Strong analytical mind with focus on attention to detail
Proactive and with a can-do attitude
Good command of English, Cantonese and preferably Mandarin

About AXA
Would you like to wake up every day driven and inspired by our noble mission and to work together as one global team to empower people to live a better life? Here at AXA we strive to lead the transformation of our industry. We are looking for talented individuals who come from varied backgrounds, think differently and want to be part of this exciting transformation by challenging the status quo so we can push AXA - a leading global brand and one of the most innovative companies in our industry - onto even greater things.


In a fast-evolving world and with a presence in 64 countries, our 166,000 employees and exclusive distributors anticipate change to offer services and solutions tailored to the current and future needs of our 103 million customers.


AXA Hong Kong, a member of the AXA Group, prides itself of serving over 1 million customers in Hong Kong and Macau. Besides being one of the largest health protection providers in Hong Kong, it is also the number 1 General Insurance provider1 and a market leader in motor insurance.


AXA Hong Kong is committed to helping its customers achieve stability and prosperity through providing a comprehensive range of life, health, property and casualty protection, as well as wealth management and retirement solutions.

We believe it is our inherent responsibility to support the communities we operate in, hence creating a sustainable business via constant and considerable contribution in the dimensions of health, environment and the community.


AXA is an equal opportunity employer. We are committed to promote Diversity and Inclusion (D&I) by creating a work environment where all employees are treated with dignity, respect, and where individual differences are valued. We welcome and treasure diverse profiles to join our big family, and to build an inclusive culture together which allows everyone to maximize their personal potential.


1Based on 2013 Office of the Commissioner of Insurance market share statistics


What We Offer
We offer excellent career prospects and attractive remuneration package to the right candidates.",https://www.indeed.hk/rc/clk?jk=4f0d9e2c1f836f60&fccid=4e9c4ad9d973d979,https://axa.taleo.net/careersection/1/jobdetail.ftl?job=136981,nan,nan,nan,nan,nan
1514871688.0,2018-01-02 13:41:28,7c932e57db23eac5,Data Scientist,Hillman Ross,Hong Kong,30+ days ago,"Contract Type:

Permanent


Location:

Hong Kong, Hong Kong


Industry:

Information Technology


Salary:

Negotiable


Reference:

5592_1509437173


Contact Name:

Lawrence Yeung


Contact Email:

Lawrence.Yeung@hillmanross.com


Job Published:

October 31, 2017 16:06

Job Description
Our client is a leading IT&T company. With its wave of implementing Internet of Things (IoT) with smart living, they are looking for a data scientist to build enterprise big data analytics solutions and Artificial Intelligence blueprint.


We are now seeking a DATA SCIENTIST


RESPONSIBILITIES

Build enterprise big data analytics and AI blueprint and collaborate with business users across the organization to assess their needs and define analytical strategy
Evaluate and implement tools for data integration, analytics, machine learning and visualization
Analyze structured and unstructured data, visualize findings and discover insights via data modeling, machine learning and optimization technique
Build real-time integration capabilities from data source and analytics platform to customer touchpoints
Standardize analytics methodology and architect to improve working efficiency

QUALIFICATIONS

Degree Holder in Statistics, Mathematics, Computer Science or related disciplines
Minimum 5 years in data science, data analysis, data mining, and creation of algorithms/data models/modeling
Proficient in R, Python, Scala, SAS, Perl, Matlab or other tools appropriate for large-scale data modeling
Good understanding of machine learning algorithms, such as k-NN, SVM, Decision Forests, etc
Experience in data visualization tools such as QlikSense
Proficiency in using query languages such as SQL, Hive, Pig
Good applied statistics skills, such as statistical testing, regression, etc
Strong oral and written presentation in English and Chinese, Mandarin is a plus

APPLY FOR THIS JOB


Interested candidate please CLICK apply button to apply online or send your resume in MS word format to Hillman Ross Recruitment Solution Professional


For more information please contact Lawrence YEUNG +852 2986 1961


Please note that only shortlisted candidate will be notified. All information will be treated in strict confidence and solely used for recruitment purposes.",https://www.indeed.hk/rc/clk?jk=7c932e57db23eac5&fccid=619397f1d2f36501,https://www.hillmanross.com/jobs/data-scientist-1,nan,nan,nan,nan,nan
1514871688.0,2018-01-02 13:41:28,4702236e6a92e291,Investment Manager,SenseTime Group Limited,Hong Kong,5 days ago,"SenseTime Group Limited is an innovative Information Technology company that harnesses Deep Learning as our core technology. We are dedicated towards spearheading break-through research and development in Deep Learning technology, so as to provide unique solutions for artificial intelligence applications and Big Data analysis.
We have congregated the most influential top-tier computer vision scientists, experts in Deep Learning, and many prominent leading figures from Google, Baidu, Microsoft and Lenovo. By leveraging our technologies, talents and patents built over the last 10 years, SenseTime is fast propelling to be the pioneer in the flourishing AI industry. We have already grasp a preeminent position at human face recognition, text and character recognition, human body recognition, mobile vehicle recognition, object recognition, and image processing, all powered by the Deep Learning technology. Geared with these cutting-edge technologies, SenseTime has been actively venturing into three primary sectors, namely finance, mobile internet, as well as security and surveillance. We have established effective collaborations with magnates of various industries, including ChinaMobile, UnionPay, NVIDIA, Huawei, NetPosa, Xiaomi, Sina Weibo, Iflytek, and JD.com (Jingdong Mall), to boost further advancement on AI products.
SenseTime has already set foot in China and our subsidiary offices are strategically set up in Beijing, Shenzhen, and Hong Kong. We aim to attract the best and brightest at all levels of expertise around the world, to join our efforts in establishing a truly original and innovative company, so as to disseminating China’s wisdom world-wide.
Join us, in this journey of our inaugural mission towards a better world for a better future.",https://www.indeed.hk/rc/clk?jk=4702236e6a92e291&fccid=c1450a7e29d67e64,https://www.cpjobs.com/hk/job/investment-manager-1969619?utm_source=indeedhk&utm_campaign=joblists&utm_medium=web,nan,nan,nan,nan,nan
1514871688.0,2018-01-02 13:41:28,fa611f4e94d101c8,Data Scientist,Classy Wheeler,"Sheung Wan, Hong Kong Island",30+ days ago,"Client Description

US-based IT service vendor


Job Description

• Degree in Computer Science, Statistics, Applied Math or related field 8+ year experience in data mining and statistical analysis Able to understand various data structures and common methods in data transformation Excellent pattern recognition and predictive modeling skills Experience with programming languages such as R/Python etc.

• Research and develop statistical learning models for data analysis Collaborate with product management and engineering departments to understand company needs and devise possible solutions Communicate results and ideas to key decision makers Implement new statistical or other mathematical methodologies as needed for specific models or analysis Optimize joint development efforts through appropriate database use and project design Proficient in Cantonese & English",https://www.indeed.hk/rc/clk?jk=fa611f4e94d101c8&fccid=7e57982cb894da40,http://classywheeler.com.hk/job/detail/479/?return_link=167292e58f499e65842f79735e3bd3ee,nan,nan,nan,nan,nan
1514871688.0,2018-01-02 13:41:28,54a147420ce7e30d,"Data Scientist in Big Data Technologies, Advanced Business A...",BASF Asia Pacific,Hong Kong,4 days ago,"Job Field: Information Technology/Service
Location: Hong Kong, HK
Company: BASF Asia Pacific
Job Type: Experienced
Job ID: EN_HK_24826

We are the world's leading chemical company because we offer intelligent solutions for our customers and for a sustainable future. We have over 110,000 employees connecting around the world. For you, this means an almost unlimited range of job opportunities, career development and lots of potential to continue learning . At BASF we believe strongly in the power of connected minds.
Description
Located in Hong Kong, BASF’s regional headquarters oversees more than 16,000 employees at about 100 sites across Asia Pacific. In addition to regional business units, Hong Kong office also houses regional functional units including Corporate Affairs, Finance and Controlling, Human Resources, Management Consulting, Procurement and Supply Chain Services. Objectives of the Position
As a data scientist with strong background in analytics-relevant information technology, the incumbent will:
act as an internal software developer in business and data analytics
be responsible for leading, executing and coordinating innovative data analytics projects and establishing sustainable IT solutions including data modelling and user interface creation
communicate the ideas and solutions to a broad community of non-data scientists Job Responsibilities
Initiate and drive new and ground-breaking development of customized business and data analytics solutions with the highest technical standards and liaise within the Advanced Business Analytics team and the global BASF community
Transfer innovative solutions from a piloting phase into a sustainable and scalable software solution for global and cross-business usage
Liaise with internal business and corporate units and translate their analytical needs into initiatives
Mentor and coach other team members and support their functions by providing expertise and insights into data and computer science Requirements
Holder of Master degree in Computer Science, Data Science, Information Systems; or Bachelor degree with additional years of relevant work experience in the industrial sector
3 to 5 years working experience with databases and SQL, SAP applications and analytics tools like SAP HANA, data warehousing, data management and Big Data technologies as well as lifecycle management of software solutions. Be able to write production-level code
Have a deep understanding of one or more of the following areas: Hadoop (HDFS, MapReduce, Hive, Yarn, Flume, Storm), Spark, Kafka, ActiveMQ
Have superior understanding of internal and external data needs in industrial business processes
Experienced in working in a diverse and global team, with a consultancy and result-oriented mindset, and enjoy working in a newly set-up team
Be able to communicate ideas and solutions to stakeholders of non-data science experts
Be creative and motivated team player with strong communication and presentation skills in English. Mandarin is a plus.
Be willing to travel up to 10%",https://www.indeed.hk/rc/clk?jk=54a147420ce7e30d&fccid=f161bd11bb997f0a,https://basf.jobs/asia-pacific-bc/job/Hong-Kong-Data-Scientist-in-Big-Data-Technologies%2C-Advanced-Business-Analytics/350070601/?feedId=111101&utm_source=Indeed&utm_medium=organic&utm_campaign=Indeed,nan,nan,nan,nan,nan
1514871688.0,2018-01-02 13:41:28,29cfc093928c1cf3,Medical Scientist,Gilead Sciences,Hong Kong,30+ days ago,"For Current Gilead Employees and Contractors:
Please log onto your Internal Career Site to apply for this job.
Job Description
Specific Responsibilities and skills for Position
The medical scientist is a Medical Affairs position whose mission is to foster collaborative relationships with scientific leaders and to facilitate the exchange of unbiased scientific information between the medical community and the company.
This position will focus on Hepatitis therapeutic area.
Work with regional TA lead in the development and and implementation of medical strategies at local and regional levels.
Provide scientific support, establish and maintain on-ongoing professional relationship with opinion leaders and societies in Hepatitis area.
Utilizes scientific resources for impactful presentations in a variety of different settings.
Responds to clinical inquiries regarding marketed or developmental Gilead products.
Identifies and develops opinion leaders to support Gilead products and trains Gilead approved speakers through personal contacts and on-site visits.
Collaborate with commercial team and provide input on marketed products aligned with corporate clinical and business objectives.
Responsible for local and regional advisory board meetings and regional educational program. Provide scientific support at local and international congress and other external meetings.
Continually monitor the disease state environment to sustain expertise in disease state management and new therapies, competitive products and features.
Support identification of data gaps. Communicate with opinion leaders to develop phase 4 studies aligned with global medical strategies.
Establish and maintain appropriate relationships with commercial, regulatory, HEOR team, therapeutic area medical lead and with external contacts as well as participate in special projects based on extensive knowledge base, experience and competency.
Assists with site selection for Gilead-Sponsored clinical trials according to the request from Clinical teams.
Travels to appointments, meetings and conferences on a regular basis, occasionally with short notice.
Essential Duties and Job Functions
Working with Country Medical Director and Regional TA lead on early development of a variety of projects, he/ she provides independent thought and initiative in the further development of specific projects and ensuing presentations and reports.
Attends major conferences and helps coordinate medical affairs activities at conferences and may present to external audience.
Review both promotional and non-promotional materials at Promotional Review Committees.
Must be fully cognizant of all relevant scientific data.
Must be cognizant of regulatory requirements for field-based personnel.
Must be committed to continuing education to maintain knowledge base.
Knowledge, Experience and Skills
The ideal candidate will be an MD, Pharm.D or Ph.D in the key therapeutic areas (Hepatitis background is preferred). Some industry experience is expected.
Clinical experience is desirable.
Must have demonstrated organizational skills to manage multiple projects simultaneously.
Excellent communication and presentation skills
Ability to travel domestically and internationally which will include occasional weekend travel",https://www.indeed.hk/rc/clk?jk=29cfc093928c1cf3&fccid=e4b075354d7c2865,https://gilead.wd1.myworkdayjobs.com/en-US/gileadcareers/job/Hong-Kong-Affiliate/Medical-Scientist_R0001371-1?source=Indeed,nan,nan,nan,nan,nan
1514871688.0,2018-01-02 13:41:28,be3a29a40b2b3443,Software Engineer,Inspire Synergy Limited,Hong Kong,,"Job SummaryAre you excited to work in a fast growing startup with fun energetic environment?Do you have a passion to create value through data processing?Have you experienced with irrelevant digital ads?If you answer with three YESs, we are dying to talk to you!Inspire Synergy is an Asia focused mobile marketing company with a strong position in data collection, targeting and advertising technologies. We are passionate to adopt programmatic mobile advertising in innovative ways. We are looking for a Software Engineer to work out of our Hong Kong office.Inspire Synergy is looking for a Software Engineer to be responsible for the development and delivery of the company’s core big data technology, the mDMP. Candidates will innovate big data ingestion and processing to discover trends, produce analysis, and apply in-depth machine learning to predict mobile user behaviours in order for us to personalise advertisements to consumers.Candidates for this entry level position must be knowledgeable in major distributed open source technologies and NoSQL platforms such as Hadoop, Spark, HBase, and Cassandra. Candidates must be comfortable working with multiple programming languages and have experience delivering large, highly scalable, highly performant systems.Responsibilities and Duties  Build software to improve existing advertising technologies and products, and implement new features requestedby customers & markets.  Build proprietary tools to facilitate terabytes data collection, processing, and visualisation in both real time and batch basis.  Participate in design and code reviews with senior engineers to define and develop new capabilities.  Work in a fast-paced, energetic, and flexible startup environment, with a talented, diverse, and forward-thinking team.  Collaborate with other team members to achieve product goals and shared metrics.  Demonstrated self-motivation to work independently, as well as a part of a high-performing team.Qualifications and Skills  MS in Computer Science, Mathematics, Engineering or related discipline from an accredited university preferred.  Major programming languages including Java, Javascript, Python.  Big data and NoSQL technologies such as Hadoop YARN, Spark, Hive, Cassandra, HBase, Storm, CASK, Kafka, Flume.  Traditional databases and data related tools such as MySQL.BenefitsJoining Inspire Synergy provides candidates an opportunity to work with a team of startup entrepreneurs, digital visionaries, data scientists and engineers form UC Berkeley, Princeton University, Columbia University, HKUST, and HK Polytechnic University. We are a fast growing company with seed investment.Job Type: InternshipSalary: $19,000.00 to $20,000.00 /monthRequired education:Master's",https://www.indeed.hk/pagead/clk?mo=r&ad=-6NYlbfkN0APMz-Y_yOGiA7fuwJNw9xDjGOJcAg2lJ9goECDYLmsiSaNAIeBzEd82h0sWYRU5S6euH6xe44w7mb7jm8W8Vgu0VZH9apxKGwrPL8H7_h014cFhzm_12fnSzerb7TJtoOPW2UM2pSuqvEnI7A4EBlp7TqQqS_rzl2CKh9RSv51qlkBBOUJxY2pOOoklUQcw7UZArtp9C6heY0ogxjRIXAJvXI9d3UPF0KMEvz_i_aSXNjjl2rlSYSmaCF6ZpKBk0XXadK1RO1jjywgr1gC1Pn08RDRsO3VhOinL-NQBKs7eXXmm2dYhbb2Sc3OANoZhca_yuxrVYeGajldmTKjJTdG74VZm4JXP7mH6QyXb9tFiILUGB5foLcH94iepKSRs51J31GAVb0B4GUvQgFffmLL2fbpR_J2A17c7HlAPdOO0Mb5nSNqtKcp&p=4&sk=&fvj=1,https://www.indeed.hk/cmp/Inspire-Synergy-Limited/jobs/Software-Engineer-be3a29a40b2b3443?sjdu=QwrRXKrqZ3CNX5W-O9jEvTbhdKQrSqlqvUbDI7nOlEN8-kFUukjbVnI7LGc_906fN3apNzTsmCGMoJAOkh_43g,nan,nan,nan,nan,nan
1514871688.0,2018-01-02 13:41:28,6aaddce1000e66b7,AI Quant Specialist – Electronic Trading (Hong Kong),Pathfinder,Hong Kong,30+ days ago,"Our client is a brokerage and investment firm focused on institutional brokerage, investment banking and asset management for corporate and institutional clients around the world.

They are looking for an outstanding Algorithmic Trading Specialist with proven AI experience to join their agile, highly professional team. This group delivers client-facing, high-availability trading algorithms and related technology.

This role is based in Hong Kong but applicants from other countries are encouraged to apply and relocation packages will be considered for the right candidates.

Responsibilities:
Using statistical/mathematical techniques and knowledge of global equity market structure (and microstructure) you will design new trading algorithms and systems, and improve existing ones

Perform quantitative research, analysis and development on our client’s electronic/algorithmic execution trading systems

Possess and continuously develop the necessary system and technical knowledge to drive analytics platform development to deliver trading excellence

Determine how the analytics platform will integrate with the delivery of developing AI algorithmic offerings

Support sales team in presenting company value proposition to clients describing/explaining analytics functional complexity

Provide AI subject matter expertise across the Algo product suite and be able to engage with clients to determine solutions ranging from custom configurations to unique Algo product developments

Requirements:
Experience with Artificial Intelligence or as a Data Scientist role is a must

BS/BA degree or higher in Mathematics, Engineering and/or Computer Science or equivalent experience

5+ years of design and development experience within an equity trading desk’s algorithmic development group

Proven track record in designing, developing and implementing sell-side trading algorithms such as VWAP, POV etc., as well as equity trading market tactics

An outstanding ability to interpret client trading strategies or needs and translate into technical specifications

A strong aptitude for analytical and quantitative thinking

Proven ability to communicate effectively at all organisational levels

Extensive knowledge of real-time algorithmic trading systems

Experience researching large data sets related to trading (tick/market data, orders and trades) is a plus

Knowledge of equity market microstructure and TCA techniques is a plus

To apply, please send your resume to careers@pathfindertalent.com and state the reference AVJX-203210 in the email subject.",https://www.indeed.hk/rc/clk?jk=6aaddce1000e66b7&fccid=cb27a4e52c66aaa3,http://pathfindertalent.com/job/ai-quant-specialist-electronic-trading-hong-kong/,nan,nan,nan,nan,nan
1514871688.0,2018-01-02 13:41:28,81015000dbd6e499,Research Scientist,DiagCor,Hong Kong,30+ days ago,"Responsibilities

Develop and launch commercial IVD products / molecular diagnostic tests
Responsible for experimental design, implementation, and data analysis
Work closely with collaborators for product validation and evaluation
Contribute to the ongoing innovation and improvement in diagnostic products
Support technology transfer and provide technical trainings

Requirements

B.Sc. in Molecular Biology, Biotechnology, Biochemistry, Medical Sciences or related discipline. Preferably with M.Phil qualification
Hands-on relevant working experience (1-2yrs) is a definite advantage. Candidates with less experience will be considered as Research Assistant
Responsible, self-motivated, result-oriented and capable of multi-tasking along with problem-solving expertise
Knowledgeable in broad range of molecular techniques including real time PCR, sequencing, DNA array and detection technologies
Creative, hard-working and capable of independent in-depth research
Good written and verbal communication skills. Team player attitude

Remarks: Appointment will be on contract or fixed terms for 2 years.",https://www.indeed.hk/rc/clk?jk=81015000dbd6e499&fccid=052e4ac318a1a4d6,http://www.diagcor.com/en/careers-in-molecular-diagnostics-MDx/detail/1-research-scientist,nan,nan,nan,nan,nan
